title,description,image_url,category
3MTT Scholarship Update,The 3MTT program is offering new scholarships for tech training across Nigeria. Apply before June 15.,https://via.placeholder.com/500x300?text=3MTT,3MTT
JAMB 2025 Registration,JAMB admits to errors for 2025 UTME exams and notified that some centers were affected.,https://via.placeholder.com/500x300?text=JAMB,JAMB
Kogi State Road Repairs,Major roads in Lokoja are being repaired to ease mobility  and improve safety.,https://via.placeholder.com/500x300?text=KOGI+ROADS,Kogi State
NYSC Monthly Allowance,"Corps members have started receiving  ₦77,000 monthly as NYSC allowance from April 2025.",https://via.placeholder.com/500x300?text=NYSC,NYSC
Petroleum Subsidy Reform,The government is adjusting the petroleum subsidy policy to improve national revenue.,https://via.placeholder.com/500x300?text=OIL+REFORM,Oil and Gas
